Course Name,Course Description
Multi-Location Remote Thermal Sensing,"In this class you will learn how to economically and accurately measure temperature at multiple, remote locations. (Dec 2021)"
Getting Started With Microchip's Plug and Play Thermocouple Temperature Sensing Solution,"This class demonstrates how to use Microchip's Thermal Management Software Utility and MCP9600 Evaluation board to select, configure and provision a MCP9600 family thermocouple. (June 2022)"
Air Speed Sensing Using Solid-State Thermal Impedance,This course shows you how to measure air speed using solid-state thermal impedance techniques. (May 2023)
Getting Started With Ultra-Wideband (UWB) RF For Distance Measurement,This class will take you through how UWB technology works and how it can be applied to non-communication applications such as distance measurement. (March 2023)
Getting Started with Highly Integrated UHF Transceivers,"In this class, we will uncover the fundamental working principles of Microchip's highly integrated UHF products, including system internals and performance. (March 2023)"
Low-Power System Design with Microchip's 32-bit Cortex M0+/M23 ARM® Microcontrollers,Low power development fundamentals for the 32-bit ATSAML10 MCU with power measurement demonstrations using the SAML10-Xplained Pro Demo Board and Data Visualizer. (Sept 2021)
Battery Charging Fundamentals,"Battery Chemistries, Terminology, Profiles and Charging Topologies for Real-World Products"
Battery Charging Applications: Introduction to Battery Pack Design,Learn how to specify and design a rechargeable battery pack made from multiple cells in various arrangements. (June 2021)
Charging Batteries from Solar,"This class will help you understand how to deal with the dynamic impedance of solar cells, apply power-point tracking algorithms, sizing your battery and solar array, and negotiating between tracking efficiency vs. the charge waveform required by your battery chemistry. (Jan 2022)"
Software Tools to Simplify Motor Control Development and Debugging: motorBench®,motorBench® Development Suite is a comprehensive software development tool for Field Oriented Motor Control (FOC). (Dec 2020)
Using X2CScope to Simplify Motor Control Development and Debugging,X2CScope is a software tool that can greatly simplify the process of motor control development and debugging. (May 2021)
Motor Control Rapid Prototyping,Model-Based Development With Commercial and Open Source tools for16 and 32-bit MCUs. (Dec 2020)
Motor Control Workshop using dsPIC® Digital Signal Controllers (DSC) Dual Core Devices,This workshop class is for those aiming for a clear understanding of 3-phase brushless permanent magnet motors and their control at the fundamental level. (May 2022)
Introduction to Solid-State Lighting,This class covers terminology for lighting as well as an introduction to lighting drivers and control techniques for solid state lighting applications. (Oct 2021)
Low Dropout Regulator Basics (LDO),This class is for those with little to no background knowledge about Low Dropout Regulators (LDO). (June 2023)
Getting Started with CIP Hybrid Power PWM Controllers and MPLAB® X SMPS Design Tools,Getting Started with CIP Hybrid Power PWM Controllers and MPLAB® X SMPS Design Tools. (Dec 2020)
Overview of Hybrid Power Control Using the MCP1911x,An overview of hybrid power controllers using the MCP1911x. (June 2022)
Analog Power Meets Digital: Using Mixed Signal MCUs to Build Advanced SMPS Topologies and Applications,Using Mixed Signal MCUs to build advanced SMPS topologies and applications. (Nov 2021)
Creating a Digital Power Supply from Scratch,This class covers the entire process of creating a digital power supply. (Nov 2021)
"Power over Ethernet (PoE), Power Delivery (PD) and DC-DC Design Considerations",This course will offer an introduction to PoE (Power over Ethernet) -PD ( Power Delivery) technology. (Sept 2021)
,
